{
  "version": 1,
  "deploymentId": "d0d0d0d0d0d0d0d0d0d0d0d0d0d0d0d0d0d0d0d0d0d0d0d0d0d0d0d0d0d0d0d0",
  "animalId": "1111111111111111111111111111111111111111111111111111111111111111",
  "events": [
    {
      "eventBytesBase64": "TFNUUgEBAADQ0NDQ0NDQ0NDQ0NDQ0NDQ0NDQ0NDQ0NDQ0NDQ0NDQ0BERERERERERERERERERERERERERERERERERERERERERVsJm2KtBo356O7gLM/YknAW9uWXGi760d1MDxpWU33cBAAAAAAAAAAEAAAAAAAAAAAAAAAAAAAAAAAAAAAAAAAAAAAAAAAAAAAAAAAAAAAAAAAAAAAAAAAAAAAAAAAAAAAAAAAAAAAAAAAAAimBFKPGQYsya2oel4iWlyWfizxSMhdhtrwLQQhLr9uEAAAAAAAAAAAAAAAAAAAAAAAAAAAAAAAAAAAAAAAAAAKGhoaGhoaGhoaGhoaGhoaGhoaGhoaGhoaGhoaGhoaGh",
      "observedRfidHex": "8000130000000001",
      "stationPubkeyHex": "036b17d1f2e12c4247f8bce6e563a440f277037d812deb33a0f4a13945d898c296",
      "stationSignatureHex": "09579de39fbd8108dea2fc89262240c45b2043d85e6e16854d9bed737e6426e109be548b3eb9d3ba3252aeba61af230a18115aeaf0b74734df88c90955f9184f",
      "txSignature": null
    },
    {
      "eventBytesBase64": "TFNUUgECAADQ0NDQ0NDQ0NDQ0NDQ0NDQ0NDQ0NDQ0NDQ0NDQ0NDQ0BERERERERERERERERERERERERERERERERERERERERERVsJm2KtBo356O7gLM/YknAW9uWXGi760d1MDxpWU33cCAAAAAAAAAAEAAABYRdwg/WsmbsmDmfCqk8c27JqneL8DivUpHl34EzS1MYpgRSjxkGLMmtqHpeIlpcln4s8UjIXYba8C0EIS6/bhi2BFKPGQYsya2oel4iWlyWfizxSMhdhtrwLQQhLr9uGhoaGhoaGhoaGhoaGhoaGhoaGhoaGhoaGhoaGhoaGhobKysrKysrKysrKysrKysrKysrKysrKysrKysrKysrKy",
      "observedRfidHex": "8000130000000001",
      "stationPubkeyHex": "036b17d1f2e12c4247f8bce6e563a440f277037d812deb33a0f4a13945d898c296",
      "stationSignatureHex": "6cd31b25d410d4ad14d1d30b5a9f6203d7f165e5a0f6f81c847dd85cff72f17a46a2d1b94a0f70d93ff6fff812a4b928a5dd8e71b263994398d975bc81ca5f5b",
      "txSignature": null
    },
    {
      "eventBytesBase64": "TFNUUgEDAADQ0NDQ0NDQ0NDQ0NDQ0NDQ0NDQ0NDQ0NDQ0NDQ0NDQ0BERERERERERERERERERERERERERERERERERERERERERVsJm2KtBo356O7gLM/YknAW9uWXGi760d1MDxpWU33cDAAAAAAAAAAIAAACnCbXST7MUSP80wVIjaKC1rT3d+zmTlkwafVCcqkyAHopgRSjxkGLMmtqHpeIlpcln4s8UjIXYba8C0EIS6/bhHFu3I1i9YwPIaklpvvBe7TD5prParIrUIHvCf09A+XiysrKysrKysrKysrKysrKysrKysrKysrKysrKysrKysrKysrKysrKysrKysrKysrKysrKysrKysrKysrKysrKy",
      "observedRfidHex": "8000130000000002",
      "stationPubkeyHex": "036b17d1f2e12c4247f8bce6e563a440f277037d812deb33a0f4a13945d898c296",
      "stationSignatureHex": "8774aeea93911a6527094615709947bf259df02e79b189c9f6cc99c3da1bfe6677fda980f132740d923ea489c8f77de2a2b2abd9b368e3442b2e0d3f8cf4a573",
      "txSignature": null
    },
    {
      "eventBytesBase64": "TFNUUgECAADQ0NDQ0NDQ0NDQ0NDQ0NDQ0NDQ0NDQ0NDQ0NDQ0NDQ0BERERERERERERERERERERERERERERERERERERERERERVsJm2KtBo356O7gLM/YknAW9uWXGi760d1MDxpWU33cEAAAAAAAAAAIAAACOjXXd56K4EeabpLGBu8HuJGI0Dgf3BIYafNHSdUsdGxxbtyNYvWMDyGpJab7wXu0w+aaz2qyK1CB7wn9PQPl4HFu3I1i9YwPIaklpvvBe7TD5prParIrUIHvCf09A+XiysrKysrKysrKysrKysrKysrKysrKysrKysrKysrKyssPDw8PDw8PDw8PDw8PDw8PDw8PDw8PDw8PDw8PDw8PD",
      "observedRfidHex": "8000130000000002",
      "stationPubkeyHex": "036b17d1f2e12c4247f8bce6e563a440f277037d812deb33a0f4a13945d898c296",
      "stationSignatureHex": "74ce09f94984d06cfac65557ed1165bf0902ab94c7fbd57716dff155a12ec74e12212881ea549984f75bc17e2e4c15cf965086f858c1e99b3ea77f868baa5f45",
      "txSignature": null
    }
  ]
}
